<?xml version="1.0" encoding="UTF-8"?>
<!DOCTYPE domain SYSTEM "abstract.dtd">

<domain db-schema="default">
	<entities>
		<entity name="Post">
			<properties>
				<identifier />
				<property name="title" type="String" />
				<property name="text" type="String" />
				<property name="date" type="Date" />
			</properties>
		</entity>
		<entity name="Comment">
			<properties>
				<identifier />
				<property name="author" type="String" />
				<property name="text" type="String" />
				<property name="post" type="Post" />
				<property name="time" type="Timestamp" />
			</properties>
		</entity>
	</entities>
</domain>